{
  "applicability": {
    "has_pointer_surface": true,
    "triggers": [
      "pointer_parameter"
    ]
  },
  "cache_invalidation_keys": [
    "source_commit=5e7d51a8f4734cac453db960d4b9919735bbf7c3",
    "slice_spec_sha256=9ba3e754bccd6de3c154736924b9be1c284d4abbc10d5b07589f6855e7e2f1b6",
    "fixture_hash=libuv-ip4-addr-fixture",
    "build_profile_hash=27f452e1250f1ec304a82293e68819618637749d78139ba16b3af9a9318c997e",
    "translator_version=0.1.0",
    "schema_version=1"
  ],
  "context_pack_ref": "validation/evidence/libuv/auto-translation/ip4-addr/l3-ip4-addr-context-pack.json",
  "dependency_edges": [
    {
      "evidence": "input_influences_output",
      "from": "ip",
      "relationship": "writes_through",
      "to": "addr"
    }
  ],
  "level": "L3",
  "pointer_nodes": [
    {
      "c_type": "const char*",
      "id": "ip",
      "kind": "raw_pointer",
      "mutability": "read_only",
      "nullability": "unknown",
      "ownership_role": "borrowed",
      "read_effects": [],
      "symbol": "ip",
      "write_effects": []
    },
    {
      "c_type": "struct sockaddr_in*",
      "id": "addr",
      "kind": "struct_pointer",
      "mutability": "write_only",
      "nullability": "unknown",
      "ownership_role": "out_param",
      "read_effects": [
        "addr->sin_family = AF_INET"
      ],
      "symbol": "addr",
      "write_effects": [
        "addr->sin_family"
      ]
    }
  ],
  "repo_commit": "5ea134269754662608534f7b7b99cc601e6a57c7",
  "risk_summary": {
    "blocked_reasons": [],
    "known_gaps": [
      "No full libuv migration claim.",
      "No IPv6 or event-loop behavior.",
      "No null pointer execution.",
      "No whole-program alias proof."
    ],
    "unsafe_expected": false
  },
  "rust_mapping": [
    {
      "pointer_node": "ip",
      "strategy": "safe public API boundary generated by bounded translator",
      "unsafe_expected": false
    },
    {
      "pointer_node": "addr",
      "strategy": "safe public API boundary generated by bounded translator",
      "unsafe_expected": false
    }
  ],
  "schema_version": 1,
  "slice_id": "ip4-addr",
  "source_boundary": {
    "direct_call_edges": [],
    "files": [
      "include/uv.h",
      "src/uv-common.c",
      "src/inet.c",
      "validation/l2_slices/fixtures/libuv-ip4-addr-input.json"
    ],
    "functions": [
      "uv_ip4_addr"
    ],
    "globals": [],
    "structs": [
      "struct sockaddr_in"
    ]
  },
  "source_commit": "5e7d51a8f4734cac453db960d4b9919735bbf7c3",
  "status": "recorded",
  "target_id": "libuv"
}
