{
  "applicability": {
    "has_pointer_surface": false,
    "triggers": [
      "none"
    ]
  },
  "cache_invalidation_keys": [
    "source_commit=demo-call-expression-20260625",
    "slice_spec_sha256=964ed8c30ac0e9f6d3241338b3e6160f67f3af7ce0fbfc5582bcb0cdc58c47bc",
    "fixture_hash=call-expression-fixture",
    "build_profile_hash=05410efef254acecefcf4bbda52bc0eec37b7602eca1b175b97b531e8858265c",
    "translator_version=0.1.0",
    "schema_version=1",
    "alias_gate=not_applicable",
    "effect_graph",
    "effect_graph_sha256=896ab200d50926fa7004f2575f6d6e69843b53f51520158194b9aeeab1710e63"
  ],
  "context_pack_ref": "validation/evidence/demo/auto-translation/call-expression/l3-call-expression-context-pack.json",
  "level": "L3",
  "not_applicable_reason": "slice has no pointer surface",
  "repo_commit": "438206f314e43f5eeb77754aaaa67ed071b659ff",
  "schema_version": 2,
  "slice_id": "call-expression",
  "source_boundary": {
    "direct_call_edges": [],
    "files": [
      "validation/l2_slices/fixtures/call-expression-chain.c",
      "validation/l2_slices/fixtures/call-expression-c-oracle.json"
    ],
    "functions": [
      "call_expression_chain"
    ],
    "globals": [],
    "structs": [
      "int"
    ]
  },
  "source_commit": "demo-call-expression-20260625",
  "status": "not_applicable",
  "target_id": "demo"
}
