{
  "applicability": {
    "has_pointer_surface": false,
    "triggers": [
      "none"
    ]
  },
  "cache_invalidation_keys": [
    "source_commit=demo-target-abi-ulong-identity-20260708",
    "slice_spec_sha256=8984e96ff70a803447116f25ac67d07188b4880ce89099b49580fe7190e3537d",
    "fixture_hash=target-abi-ulong-identity-fixture",
    "build_profile_hash=b0330d12eed85cd57bda4f5fc400390bc81b0b8f2c67ad00203dd29c3e9ecc74",
    "translator_version=0.1.0",
    "schema_version=1",
    "alias_gate=not_applicable",
    "effect_graph",
    "effect_graph_sha256=896ab200d50926fa7004f2575f6d6e69843b53f51520158194b9aeeab1710e63"
  ],
  "context_pack_ref": "validation/evidence/demo/auto-translation/target-abi-ulong-identity/l3-target-abi-ulong-identity-context-pack.json",
  "level": "L3",
  "not_applicable_reason": "slice has no pointer surface",
  "repo_commit": "8e11561355d4ff2c674f395db1b6a2475c27478c",
  "schema_version": 2,
  "slice_id": "target-abi-ulong-identity",
  "source_boundary": {
    "direct_call_edges": [],
    "files": [
      "validation/l2_slices/fixtures/target-abi-ulong-identity.c"
    ],
    "functions": [
      "target_abi_ulong_identity"
    ],
    "globals": [],
    "structs": [
      "unsigned long"
    ]
  },
  "source_commit": "demo-target-abi-ulong-identity-20260708",
  "status": "not_applicable",
  "target_id": "demo"
}
